{"authoritative_contracts":{"application_namespace":"/api/v1/fhss","openapi":{"path":"examples/DSP/dashboard/api/openapi.json","sha256":"c1cc7f8e85f5dad47d8ed7b0b14f5657ae9597794c319324e48f58fa2bd9b253"},"root_entrypoint":"/","schemas":[{"path":"examples/DSP/dashboard/api/schemas/command-result.schema.json","sha256":"3fdc03508845696fe89efe1430dbb9884900ebfcbc94f28f0d0b2725ace2ab51"},{"path":"examples/DSP/dashboard/api/schemas/config-result.schema.json","sha256":"7fa58b0d2436eda77aa02d597a6531895b8d8b1b9923e23a84557ee2592c7840"},{"path":"examples/DSP/dashboard/api/schemas/config-validation.schema.json","sha256":"dec49fae2a80980a55ebfaa2f9ba24e07bbc3cafc76ebdae1b4e4a0557eaaba9"},{"path":"examples/DSP/dashboard/api/schemas/config.schema.json","sha256":"8aac395037f1db6276e0cf5eadf64ef31600b6d060abf9399256263062f81b2e"},{"path":"examples/DSP/dashboard/api/schemas/configuration-provenance.schema.json","sha256":"5b26db9cd6f973effcfa987577dba75b7dbc86fabdc47aaa3ebcc6ce53dd32ac"},{"path":"examples/DSP/dashboard/api/schemas/derived-paths.schema.json","sha256":"b383db735ac11dea0c9fb2d9dd0fc7b5f65a4d3248e9800570cf3b6ef747f17c"},{"path":"examples/DSP/dashboard/api/schemas/diagnostics.schema.json","sha256":"0bd4c7045eaf05a39f7aab186ad56b3c996d691ad1d77328fb5a7573f888ee91"},{"path":"examples/DSP/dashboard/api/schemas/edge-metrics.schema.json","sha256":"f7fbe0404c3abac6064450e800de53d239d134641c555eae5ddacccd67272443"},{"path":"examples/DSP/dashboard/api/schemas/event.schema.json","sha256":"1fecb2d7996b3938070f5d2fe2da070786b799088c3d85fcd7d3e67b43ddd322"},{"path":"examples/DSP/dashboard/api/schemas/events.schema.json","sha256":"04db8a68e7af5d8f3c4953156fb8e69dfe995463617e4ab4368f3803bb42e859"},{"path":"examples/DSP/dashboard/api/schemas/fhss-build-api-manifest.schema.json","sha256":"efe798d7162aa488bb020309f8889333f135372b8e5f5a8ec84615304bd7f84b"},{"path":"examples/DSP/dashboard/api/schemas/fhss-comparison-result.schema.json","sha256":"4f687f3e8be12a61c3f1bdefb653cde24372ecc8b163284035cc35c849b39ee4"},{"path":"examples/DSP/dashboard/api/schemas/fhss-expected-truth.schema.json","sha256":"e282406dbb8d027658421cacbbea281fb3a040b269c2ce593fb2582cb517e614"},{"path":"examples/DSP/dashboard/api/schemas/fhss-external-iq-reference.schema.json","sha256":"2f97d213d271cab3efe2c0b568688184859741217c7d6b142e111fb99c1fde4c"},{"path":"examples/DSP/dashboard/api/schemas/fhss-investigation-artifact-entry.schema.json","sha256":"841d43e14992d6c6dcef0391393d8cc788c8853f1298720f0a31ee19ab5e1277"},{"path":"examples/DSP/dashboard/api/schemas/fhss-investigation-export-request.schema.json","sha256":"a08eaa2249f48ecf13b5cf0b1dce5d157bc08ec3d322b2c9a729214886280ac3"},{"path":"examples/DSP/dashboard/api/schemas/fhss-investigation-export-result.schema.json","sha256":"1ddf74c04647eccd5d06a6dcfd87960333779dd4f2a796df268a23a73fb13509"},{"path":"examples/DSP/dashboard/api/schemas/fhss-investigation-manifest.schema.json","sha256":"0db6c270bd078a278c626e80410df0dbca0179bc36b846b63c1c6bf7e126ccff"},{"path":"examples/DSP/dashboard/api/schemas/fhss-investigation-operation.schema.json","sha256":"3a435d37353ab999989b15f0ae83c3c2b28946a102af944852da480c51c3dea0"},{"path":"examples/DSP/dashboard/api/schemas/fhss-investigation-operations.schema.json","sha256":"050fc24a06960bccf7b371ac64b622332c3fa7e16854ff83da61ddc991460c5d"},{"path":"examples/DSP/dashboard/api/schemas/fhss-investigation-provenance.schema.json","sha256":"1460bc59b7ad6298548e4b554787bee42386702deeb06d3ba70a3888f0f3bc50"},{"path":"examples/DSP/dashboard/api/schemas/fhss-investigation-quota.schema.json","sha256":"f0e111e7ee74c12c1a74f7a6610057cbee10346d161ed4ae06bd7c105858bc37"},{"path":"examples/DSP/dashboard/api/schemas/fhss-investigation-replay-request.schema.json","sha256":"3abcf1f2b69915dabf2a55bef38aad61f9a01bc5e87d090bfca863974f7411bc"},{"path":"examples/DSP/dashboard/api/schemas/fhss-investigation-replay-result.schema.json","sha256":"a950dce58ad3475e44e69da79871f0f67968ea7f5a9de96760debf52d014f19e"},{"path":"examples/DSP/dashboard/api/schemas/fhss-investigation-validation-request.schema.json","sha256":"5e3e889158c61eaed821862b6a98a1769f2b28a305887fe7258201a359d1c640"},{"path":"examples/DSP/dashboard/api/schemas/fhss-investigation-validation-result.schema.json","sha256":"ffbe7ff5ee8b119da3f3903a0e04df62fec34e849dcadcaba7312a6ef2e30779"},{"path":"examples/DSP/dashboard/api/schemas/fhss-iq-truth.schema.json","sha256":"772713a74f7a3a774d6658372d905757dd1ddd1d993fea218ba00495d363abc5"},{"path":"examples/DSP/dashboard/api/schemas/fhss-job-history.schema.json","sha256":"6fd95608a16478432b36e4941784b51d953eddf9a4defcb74d5e47fb10631679"},{"path":"examples/DSP/dashboard/api/schemas/fhss-job-request.schema.json","sha256":"fd5deff9c9c12c4b9f2da36086655452ea77daf2e1777cb5e6363ba6354010ef"},{"path":"examples/DSP/dashboard/api/schemas/fhss-job-reset.schema.json","sha256":"83afdcdb4d6cef11881c0a6e2aaf65a2beebced66f73a1d0707d884f7b97bb3b"},{"path":"examples/DSP/dashboard/api/schemas/fhss-job.schema.json","sha256":"9cedcb1e7e4bbb63a65183abe9f5d47cc81ded2f01b25f352ef9437df0f7fa18"},{"path":"examples/DSP/dashboard/api/schemas/fhss-observation-history.schema.json","sha256":"8d11fffbf0df942588cb40fc9589e0c49d522303f5b735510cb42a7b0d0c6f5a"},{"path":"examples/DSP/dashboard/api/schemas/fhss-observation-provenance.schema.json","sha256":"00c73de07135dfec9b0d8d305639d25b6745139a03af46c4605b152a07fc5c80"},{"path":"examples/DSP/dashboard/api/schemas/fhss-operator-actions.schema.json","sha256":"83b7a14a2081282e551de2aa0b37c2d2dfb3e8ddd869db309bf1107134a78391"},{"path":"examples/DSP/dashboard/api/schemas/fhss-receiver-graph.schema.json","sha256":"eebe9f33f0f4257d60aa25dbb34a9176b1e0ca9b1467d18a71cbb30c2fe0f148"},{"path":"examples/DSP/dashboard/api/schemas/fhss-receiver-observation.schema.json","sha256":"6b3d4a537fa709150ee520f08fc4266dce47a41b8e16741e4272378683a03134"},{"path":"examples/DSP/dashboard/api/schemas/fhss-receiver-result.schema.json","sha256":"753a2edbb779e10b628e4c9fe379343fe9b1a5b3d18e6110ca623a47d2c26f9f"},{"path":"examples/DSP/dashboard/api/schemas/fhss-receiver-spectrum.schema.json","sha256":"68003609e3d1685cf43ec0a868ae4e7a5d733385463a911f0c0ff5944944efa2"},{"path":"examples/DSP/dashboard/api/schemas/fhss-snapshot.schema.json","sha256":"cefa05c0846b9f59c91ba55a93420215ed362d8475a77c4451bd06cdcd5e1bc3"},{"path":"examples/DSP/dashboard/api/schemas/graph.schema.json","sha256":"b5c5543b14254edba6967ed34b1394d1eea56fe57a3e2f0cf8d27307826d02dd"},{"path":"examples/DSP/dashboard/api/schemas/health.schema.json","sha256":"5696bc51e11ed0296e0a8ad998b5f069ac6778cfd05d2f03474b48d9e07a5283"},{"path":"examples/DSP/dashboard/api/schemas/metrics.schema.json","sha256":"cd91363c8880b1b5f8681040cebd1be20b5c5ae38d077fc620380db8c56c4819"},{"path":"examples/DSP/dashboard/api/schemas/node-parameters.schema.json","sha256":"34db95fa56978649f435108cd2d23d932e0dacd53a08ad5f8b6c5daa0e0cea2c"},{"path":"examples/DSP/dashboard/api/schemas/node.schema.json","sha256":"f3e109c8d300428998245ca56be1f896d71f86c261de58f2b790992bbdcfd48a"},{"path":"examples/DSP/dashboard/api/schemas/problem.schema.json","sha256":"c83c1fde38aeef7c106a3ad484a5f114bb9db574236633dc5e4493359acc3639"},{"path":"examples/DSP/dashboard/api/schemas/readiness.schema.json","sha256":"9b279bbc29a83b265e19a83fcd7240da5d5534f1d8024193cc66035208bd4aa9"},{"path":"examples/DSP/dashboard/api/schemas/rebuild-result.schema.json","sha256":"01d2c5538a67c51a71c986025cf1fa4f8f1acf86198444964c0066619e4179e9"},{"path":"examples/DSP/dashboard/api/schemas/receiver-graph.schema.json","sha256":"a8bb68a07a93873ded11cd707f89fa3c4b9c1018a760ba448e8003709e609c65"},{"path":"examples/DSP/dashboard/api/schemas/runtime-status.schema.json","sha256":"7f69294e1c57bf77d3e974d21fb2cb92b84a2d552980c6f5b5b3e715e69ba78a"},{"path":"examples/DSP/dashboard/api/schemas/scenario.schema.json","sha256":"f0813792a44384961b715885c367f1c71c7134fa97c120c69a4fc79972fe3a70"},{"path":"examples/DSP/dashboard/api/schemas/value.schema.json","sha256":"34733e5955ce14dd54de5c4fa837736b31d2c786a868582bf7ad172a86dc96c9"},{"path":"examples/DSP/dashboard/api/schemas/version.schema.json","sha256":"6d2fe44b65e55098136a75857fba639a70981d7dd611c5a93f3938c5d1bcb595"},{"path":"examples/DSP/dashboard/api/schemas/visualization.schema.json","sha256":"d779ffa49ddbe37d469830c7d627fff4793e3f1b85d121da32010e20b4b7194d"},{"path":"examples/DSP/dashboard/api/schemas/websocket-heartbeat-ack.schema.json","sha256":"ae44a49fe7feb1e2e0c79a6e10f48a939923538a357d0417479fdd4fbf8636c3"},{"path":"examples/DSP/dashboard/api/schemas/websocket-heartbeat.schema.json","sha256":"33dbff4ebe032cfabf1b0e52bdc6b5adbdd6c3c9dcfc4f62c4fc8862682d451f"},{"path":"examples/DSP/dashboard/api/schemas/websocket-hello.schema.json","sha256":"1d5b974d21c44bfc62652843b88061c4e0c6d5573b4175a22110a7506c535b5f"},{"path":"examples/DSP/dashboard/api/schemas/websocket-resync-required.schema.json","sha256":"6200ab264e2993924d13c8ef37b664653bb1592cca41eb00bd7bce4dd8064dad"},{"path":"examples/DSP/dashboard/api/schemas/websocket-subscribe.schema.json","sha256":"95a573cdb0ffb5d315bd82089ef3cc1dfc7347118e25d2b93374e9c82b5100a0"}]},"canonicalization":"json-sort-keys-compact-utf8-lf-v1","feature_expectations":{"comparison":"explicit expected-versus-observed evaluation","configuration":"validate, stage, atomically apply, and preserve strong identity","event_recovery":"ordered envelopes, replay, gap detection, and coherent snapshot resync","investigations":"export, validate, and replay linked synthetic artifacts","message_jobs":"bounded synthetic job control without receiver truth injection","observations":"receiver-derived and separate from expected truth","runtime_lifecycle":"rebuild, start, stop, and report truthful state","shutdown":"bounded stop, join, and port release","spectrum":"bounded receiver-side spectrum or explicit unavailability"},"frontend_assets":{"exact_release_agreement_required":true,"installed_expected":{"entries":[{"bytes":23306,"path":"assets/index-B5_9AVU9.css","sha256":"800